{
  "symbol": "ZZNEO",
  "company": "Synthetica Gas Works (FICTIONAL)",
  "proposed_node": "neon_reclaim_skids",
  "kind": "new_ticker",
  "proposed_role": "direct",
  "why_fit": "One of two qualified OEMs for UHP neon reclaim skids (SYNTHETIC premise); certification moat and 2-3y capacity lead time make it a direct beneficiary of the reclaim build-out.",
  "evidence": [
    {
      "source": "Synthetic 10-K",
      "tier": "primary",
      "summary": "Reclaim-skid segment = 35% of revenue; booked capacity POs disclosed; one customer contract (~5% of segment revenue) carries a partial price-escalator clause.",
      "date": "2026-02-15",
      "url": "https://example.invalid/10k"
    },
    {
      "source": "Synthetic trade press",
      "tier": "secondary",
      "summary": "Fab operators quoted on multi-quarter skid waitlists.",
      "date": "2026-03-02"
    },
    {
      "source": "Synthetic industry capacity survey",
      "tier": "secondary",
      "summary": "The two qualified skid OEMs hold >=70% of certified reclaim-capacity installs.",
      "date": "2026-02-20"
    },
    {
      "source": "Synthetic market data",
      "tier": "market_implied",
      "summary": "Valuation rich: trades above the information/industrial-gas peer median and consensus estimates already carry the reclaim build-out.",
      "date": "2026-03-05"
    },
    {
      "source": "Synthetic market data",
      "tier": "market_implied",
      "summary": "Known but not crowded: moderate coverage; price not extended versus estimate revisions.",
      "date": "2026-03-05"
    },
    {
      "source": "Synthetic litho OEM technical note",
      "tier": "secondary",
      "summary": "Substitution requires new air-separation trains plus laser re-qualification; greenfield reclaim capacity takes 2-3 years including fab qualification.",
      "date": "2026-02-25"
    }
  ],
  "known_risks": "Pricing power is episodic; a reclaim capacity glut or a neon-free laser platform would break the node; 65% of the company is unrelated industrial gas distribution.",
  "missing_info": "Skid-segment gross margin not disclosed separately.",
  "suggested_next_step": "GATE, then EVALUATE with bear-case-first if it clears."
}
